{
  "id": "fb74aa2c-7691-4ff3-b00e-943b8dbcc863",
  "type": "result.review",
  "agent": {
    "name": "blackbox",
    "role": "dev-support"
  },
  "target": {
    "roles": [
      "analysis",
      "dev-support"
    ],
    "repos": [
      "Yega-API"
    ]
  },
  "task": {
    "id": "2507e7fb-5cc6-4eed-8b33-3fb6b51a8db6",
    "title": "E2E: análisis y soporte dev",
    "description": "",
    "repo": "Yega-API",
    "status": "pending"
  },
  "payload": {
    "provider": "blackbox",
    "model": "blackboxai/anthropic/claude-3.7-sonnet",
    "status": 200,
    "structured": {
      "version": "mcp/analysis@1",
      "summary": "Análisis para implementación de pruebas E2E en Yega-API utilizando Supertest y Vitest, con enfoque en aislamiento de entornos, cobertura de rutas críticas y automatización de CI/CD",
      "risks": [
        "Entornos de prueba no aislados pueden contaminar datos de producción",
        "Cobertura insuficiente de pruebas puede dejar vulnerabilidades sin detectar",
        "Pruebas lentas pueden afectar negativamente la experiencia de desarrollo",
        "Dependencias externas no simuladas pueden causar falsos negativos",
        "Falta de mantenimiento de pruebas E2E puede generar deuda técnica"
      ],
      "plan": [
        "Configurar entorno de pruebas E2E con base de datos dedicada",
        "Implementar helpers para inicialización y limpieza de datos de prueba",
        "Desarrollar pruebas de integración para rutas críticas con Supertest",
        "Implementar mocks para servicios externos",
        "Configurar pipeline de CI/CD para ejecución automática de pruebas E2E",
        "Documentar proceso de ejecución de pruebas y mantenimiento",
        "Implementar métricas de cobertura de pruebas E2E"
      ],
      "tests": [
        {
          "area": "api/auth",
          "notes": "Pruebas de registro, login, refresh token y logout con verificación de JWT"
        },
        {
          "area": "api/data-access",
          "notes": "Pruebas de operaciones CRUD con verificación de permisos y validación de datos"
        },
        {
          "area": "api/integration",
          "notes": "Pruebas de integración con servicios externos usando mocks"
        },
        {
          "area": "api/performance",
          "notes": "Pruebas de carga básicas para endpoints críticos"
        }
      ]
    },
    "content": "# Análisis E2E para Yega-API: Soporte de Desarrollo\n\n## Resumen Ejecutivo\n\nEl análisis revela la necesidad de implementar pruebas E2E completas en Yega-API para garantizar la integridad del sistema. Se recomienda establecer un entorno de pruebas aislado con bases de datos de prueba, implementar pruebas de integración con Supertest y configurar un pipeline de CI/CD para ejecución automática.\n\n```json\n{\n  \"version\": \"mcp/analysis@1\",\n  \"summary\": \"Análisis para implementación de pruebas E2E en Yega-API utilizando Supertest y Vitest, con enfoque en aislamiento de entornos, cobertura de rutas críticas y automatización de CI/CD\",\n  \"risks\": [\n    \"Entornos de prueba no aislados pueden contaminar datos de producción\",\n    \"Cobertura insuficiente de pruebas puede dejar vulnerabilidades sin detectar\",\n    \"Pruebas lentas pueden afectar negativamente la experiencia de desarrollo\",\n    \"Dependencias externas no simuladas pueden causar falsos negativos\",\n    \"Falta de mantenimiento de pruebas E2E puede generar deuda técnica\"\n  ],\n  \"plan\": [\n    \"Configurar entorno de pruebas E2E con base de datos dedicada\",\n    \"Implementar helpers para inicialización y limpieza de datos de prueba\",\n    \"Desarrollar pruebas de integración para rutas críticas con Supertest\",\n    \"Implementar mocks para servicios externos\",\n    \"Configurar pipeline de CI/CD para ejecución automática de pruebas E2E\",\n    \"Documentar proceso de ejecución de pruebas y mantenimiento\",\n    \"Implementar métricas de cobertura de pruebas E2E\"\n  ],\n  \"tests\": [\n    {\n      \"area\": \"api/auth\",\n      \"notes\": \"Pruebas de registro, login, refresh token y logout con verificación de JWT\"\n    },\n    {\n      \"area\": \"api/data-access\",\n      \"notes\": \"Pruebas de operaciones CRUD con verificación de permisos y validación de datos\"\n    },\n    {\n      \"area\": \"api/integration\",\n      \"notes\": \"Pruebas de integración con servicios externos usando mocks\"\n    },\n    {\n      \"area\": \"api/performance\",\n      \"notes\": \"Pruebas de carga básicas para endpoints críticos\"\n    }\n  ]\n}\n```\n\n## Análisis Detallado\n\n### Configuración del Entorno de Pruebas\n\nEs fundamental establecer un entorno de pruebas aislado para evitar interferencias con datos de producción:\n\n1. **Base de datos dedicada**: Configurar una base de datos específica para pruebas E2E con Prisma\n2. **Variables de entorno**: Crear archivo `.env.test` para configuraciones específicas de prueba\n3. **Scripts de inicialización**: Desarrollar scripts para preparar el entorno antes de las pruebas\n\n### Implementación de Pruebas\n\nLas pruebas E2E deben cubrir los flujos completos de usuario:\n\n```typescript\n// Ejemplo de estructura de prueba E2E con Vitest y Supertest\nimport { describe, it, beforeAll, afterAll } from 'vitest';\nimport request from 'supertest';\nimport { app } from '../src/app';\nimport { prisma } from '../src/lib/prisma';\n\ndescribe('Auth API', () => {\n  beforeAll(async () => {\n    // Inicializar datos de prueba\n    await prisma.user.create({\n      data: {\n        email: 'test@example.com',\n        password: 'hashedPassword123',\n        // otros campos necesarios\n      }\n    });\n  });\n\n  afterAll(async () => {\n    // Limpiar datos de prueba\n    await prisma.user.deleteMany({\n      where: { email: 'test@example.com' }\n    });\n  });\n\n  it('should authenticate a valid user', async () => {\n    const response = await request(app)\n      .post('/api/auth/login')\n      .send({\n        email: 'test@example.com',\n        password: 'password123'\n      });\n    \n    expect(response.status).toBe(200);\n    expect(response.body).toHaveProperty('token');\n  });\n});\n```\n\n### Impacto en DX y Seguridad\n\n- **Experiencia de desarrollo**: Las pruebas E2E bien implementadas mejoran la confianza en los cambios y reducen la regresión\n- **Seguridad**: Permiten detectar vulnerabilidades en flujos completos que podrían pasar desapercibidas en pruebas unitarias\n\n### Próximos Pasos\n\n1. Revisar la estructura actual del proyecto para identificar rutas críticas\n2. Implementar el entorno de pruebas aislado\n3. Desarrollar las primeras pruebas para flujos de autenticación\n4. Expandir gradualmente la cobertura a otras áreas de la API\n\nEste enfoque garantizará una implementación efectiva de pruebas E2E que mejorará la calidad y confiabilidad de Yega-API.",
    "kind": "analysis"
  },
  "meta": {
    "timestamp": "2025-08-29T04:31:11.981Z",
    "version": "2.0",
    "correlationId": "8f509a54-d47f-476e-8b51-cf4d5879cf91"
  }
}